{
  "$schema": "../../../schema/descriptor.schema.json",
  "id": "da/api-plugin-from-scratch-bearer",
  "name": "Declarative Agent with API Plugin using API Key",
  "languages": ["typescript", "javascript"],
  "minEngineVersion": "6.11.0",
  "spec": "docs/03-specs/scenarios/da/create-api-plugin-from-scratch-bearer.md",
  "requiresNetwork": false,

  "optionsSchema": {
    "type": "object",
    "properties": {},
    "additionalProperties": false
  },

  "replaceMap": [
    { "var": "NewDeveloperPortalApis", "when": "featureFlag('TEAMSFX_NEW_DP_APIS')", "value": "true" },
    { "var": "SafeProjectNameLowerCase", "expr": "safeProjectNameLowerCase(appName)" }]
}
