{
  "$schema": "../../schema/descriptor.schema.json",
  "id": "custom-copilot-rag-azure-ai-search",
  "name": "Teams Agent with Data from Azure AI Search",
  "languages": ["typescript", "javascript", "python"],
  "languageOptions": [
    { "id": "python", "description": "core.createProjectQuestion.option.description.preview" }
  ],
  "minEngineVersion": "6.12.0",
  "spec": "docs/03-specs/scenarios/teams/create-custom-copilot-rag-azure-ai-search.md",
  "requiresNetwork": false,

  "optionsSchema": {
    "type": "object",
    "properties": {
      "llmService": { "type": "string" },
      "openAIKey": { "type": "string" },
      "azureOpenAIKey": { "type": "string" },
      "azureOpenAIEndpoint": { "type": "string" },
      "azureOpenAIDeploymentName": { "type": "string" }
    },
    "additionalProperties": false
  },

  "replaceMap": [
    { "var": "NewDeveloperPortalApis", "when": "featureFlag('TEAMSFX_NEW_DP_APIS')", "value": "true" },
    { "var": "SafeProjectNameLowerCase", "expr": "safeProjectNameLowerCase(appName)" },
    { "var": "SandBoxedTeam", "when": "featureFlag('TEAMSFX_SANDBOXED_TEAM')", "value": "true" },
    { "var": "CEAEnabled", "when": "featureFlag('TEAMSFX_CEA_ENABLED')", "value": "true" },
    { "var": "pathDelimiter", "expr": "pathDelimiter()" },
    { "var": "useOpenAI", "when": "llmService == 'llm-service-openai'", "value": "true" },
    { "var": "useAzureOpenAI", "when": "llmService != 'llm-service-openai'", "value": "true" },
    { "var": "openAIKey", "from": "openAIKey" },
    { "var": "azureOpenAIKey", "from": "azureOpenAIKey" },
    { "var": "azureOpenAIEndpoint", "from": "azureOpenAIEndpoint" },
    { "var": "azureOpenAIDeploymentName", "from": "azureOpenAIDeploymentName" },
    { "var": "azureOpenAIEmbeddingDeploymentName", "const": "" },
    { "var": "azureSearchEndpoint", "const": "" },
    { "var": "secretAzureSearchKey", "const": "" }
  ]
}
